{
  "spec_version": "0.4",
  "kind": "materialization-profile",
  "blueprint": {
    "id": "asr-whisper-iree",
    "version": "0.1.0"
  },
  "target": "vulkan-armv7",
  "flavors": [
    "de"
  ],
  "cartridge": {
    "version": "0.1.0"
  },
  "signing": {
    "keyid": "my-dev-key",
    "signer": "<you>",
    "key_ref": "CARTRIDGE_SIGNING_KEY"
  }
}
