{
  "spec_version": "0.4",
  "kind": "materialization-profile",
  "blueprint": {
    "id": "detection-yolov8-iree",
    "version": "0.1.0"
  },
  "target": "cpu-arm64",
  "cartridge": {
    "version": "0.1.0"
  },
  "signing": {
    "keyid": "my-dev-key",
    "signer": "<you>",
    "key_ref": "CARTRIDGE_SIGNING_KEY"
  }
}
