{
  "spec_version": "0.4",
  "kind": "materialization-profile",
  "blueprint": {
    "id": "generator-llama32-1b-skainet",
    "version": "0.1.0"
  },
  "target": "jvm",
  "cartridge": {
    "id": "generator-llama32-1b-skainet-jvm",
    "version": "0.1.0"
  },
  "license_acceptance": [
    {
      "source": "llama32-1b-instruct-gguf",
      "license": "Llama 3.2 Community License",
      "terms_url": "https://www.llama.com/llama3_2/license/",
      "accepted_by": "<you \u2014 a record of a decision a person made, never a default>",
      "accepted_at": "1970-01-01"
    }
  ]
}